{
    "week": "string (e.g., '2025-W29')",
    "date_range": "string (ISO or friendly format)",
    "items": {
      "experiments_and_research": [
        { "id": "string", "text": "string" }
      ],
      "coding_and_projects": [
        { "id": "string", "text": "string" }
      ],
      "systems_engineering_work": [
        { "id": "string", "text": "string" }
      ],
      "content_ideas": [
        { "id": "string", "text": "string" }
      ],
      "notes_and_observations": [
        { "id": "string", "text": "string" }
      ]
    },
    "metadata": {
      "tools_used": ["string"],
      "tags": ["string"],
      "source": "string",
      "generated_at": "ISO timestamp"
    }
  }
  