{
    "week": "2025-W29",
    "date_range": "2025-07-15 to 2025-07-21",
    "items": {
      "experiments_and_research": [
        { "id": "e1", "text": "Explored AI-agent workflows in Systems Engineering" },
        { "id": "e2", "text": "Tested toolchain for functional flow automation" }
      ],
      "coding_and_projects": [
        { "id": "c1", "text": "Built internal API gateway for fuel cell toolset" },
        { "id": "c2", "text": "Prototyped dashboard UI with Supabase and React" }
      ],
      "systems_engineering_work": [
        { "id": "s1", "text": "Defined propulsion subsystem functional architecture" },
        { "id": "s2", "text": "Updated requirements per ARP4754A process" }
      ],
      "content_ideas": [
        { "id": "ci1", "text": "Blog: 'How AI agents can reshape SE workflows'" },
        { "id": "ci2", "text": "Twitter post on clean SE APIs for hardware" }
      ],
      "notes_and_observations": [
        { "id": "n1", "text": "Voice-based recall is superior to notes for systems thinking" }
      ]
    },
    "metadata": {
      "tools_used": ["Python", "Supabase", "GPT-4o"],
      "tags": ["systems_engineering", "ai", "architecture", "week-review"],
      "source": "EchoForge Listener",
      "generated_at": "2025-07-21T17:42:00Z"
    }
  }
  